[
  {
    "model_benchmark_id": 1261,
    "benchmark_id": "ai2d",
    "model_id": "pixtral-large",
    "score": 0.938,
    "normalized_score": 0.938,
    "is_self_reported": true,
    "self_reported_source_link": "https://mistral.ai/news/pixtral-large/",
    "verified_by_llmstats": false,
    "analysis_method": "BBox",
    "verification_provider_id": null,
    "verification_hardware": null,
    "verification_date": null,
    "verification_notes": null,
    "created_at": "2025-07-19T19:56:13.645378+00:00",
    "updated_at": "2025-07-19T19:56:13.645378+00:00",
    "benchmark_name": "AI2D"
  },
  {
    "model_benchmark_id": 873,
    "benchmark_id": "chartqa",
    "model_id": "pixtral-large",
    "score": 0.881,
    "normalized_score": 0.881,
    "is_self_reported": true,
    "self_reported_source_link": "https://mistral.ai/news/pixtral-large/",
    "verified_by_llmstats": false,
    "analysis_method": "CoT",
    "verification_provider_id": null,
    "verification_hardware": null,
    "verification_date": null,
    "verification_notes": null,
    "created_at": "2025-07-19T19:56:12.820802+00:00",
    "updated_at": "2025-07-19T19:56:12.820802+00:00",
    "benchmark_name": "ChartQA"
  },
  {
    "model_benchmark_id": 898,
    "benchmark_id": "docvqa",
    "model_id": "pixtral-large",
    "score": 0.933,
    "normalized_score": 0.933,
    "is_self_reported": true,
    "self_reported_source_link": "https://mistral.ai/news/pixtral-large/",
    "verified_by_llmstats": false,
    "analysis_method": "ANLS",
    "verification_provider_id": null,
    "verification_hardware": null,
    "verification_date": null,
    "verification_notes": null,
    "created_at": "2025-07-19T19:56:12.869454+00:00",
    "updated_at": "2025-07-19T19:56:12.869454+00:00",
    "benchmark_name": "DocVQA"
  },
  {
    "model_benchmark_id": 536,
    "benchmark_id": "mathvista",
    "model_id": "pixtral-large",
    "score": 0.694,
    "normalized_score": 0.694,
    "is_self_reported": true,
    "self_reported_source_link": "https://mistral.ai/news/pixtral-large/",
    "verified_by_llmstats": false,
    "analysis_method": "CoT",
    "verification_provider_id": null,
    "verification_hardware": null,
    "verification_date": null,
    "verification_notes": null,
    "created_at": "2025-07-19T19:56:12.109764+00:00",
    "updated_at": "2025-07-19T19:56:12.109764+00:00",
    "benchmark_name": "MathVista"
  },
  {
    "model_benchmark_id": 1732,
    "benchmark_id": "mm-mt-bench",
    "model_id": "pixtral-large",
    "score": 74.0,
    "normalized_score": 0.74,
    "is_self_reported": true,
    "self_reported_source_link": "https://mistral.ai/news/pixtral-large/",
    "verified_by_llmstats": false,
    "analysis_method": "GPT-4o Judge",
    "verification_provider_id": null,
    "verification_hardware": null,
    "verification_date": null,
    "verification_notes": null,
    "created_at": "2025-07-19T19:56:14.885715+00:00",
    "updated_at": "2025-07-19T19:56:14.885715+00:00",
    "benchmark_name": "MM-MT-Bench"
  },
  {
    "model_benchmark_id": 586,
    "benchmark_id": "mmmu",
    "model_id": "pixtral-large",
    "score": 0.64,
    "normalized_score": 0.64,
    "is_self_reported": true,
    "self_reported_source_link": "https://mistral.ai/news/pixtral-large/",
    "verified_by_llmstats": false,
    "analysis_method": "CoT",
    "verification_provider_id": null,
    "verification_hardware": null,
    "verification_date": null,
    "verification_notes": null,
    "created_at": "2025-07-19T19:56:12.205240+00:00",
    "updated_at": "2025-07-19T19:56:12.205240+00:00",
    "benchmark_name": "MMMU"
  },
  {
    "model_benchmark_id": 1574,
    "benchmark_id": "vqav2",
    "model_id": "pixtral-large",
    "score": 0.809,
    "normalized_score": 0.809,
    "is_self_reported": true,
    "self_reported_source_link": "https://mistral.ai/news/pixtral-large/",
    "verified_by_llmstats": false,
    "analysis_method": "VQA Match",
    "verification_provider_id": null,
    "verification_hardware": null,
    "verification_date": null,
    "verification_notes": null,
    "created_at": "2025-07-19T19:56:14.414450+00:00",
    "updated_at": "2025-07-19T19:56:14.414450+00:00",
    "benchmark_name": "VQAv2"
  }
]