[
  {
    "model_benchmark_id": 455,
    "benchmark_id": "aime-2024",
    "model_id": "qwen3-30b-a3b",
    "score": 0.804,
    "normalized_score": 0.804,
    "is_self_reported": true,
    "self_reported_source_link": "https://qwenlm.github.io/blog/qwen3/",
    "verified_by_llmstats": false,
    "analysis_method": "Accuracy",
    "verification_provider_id": null,
    "verification_hardware": null,
    "verification_date": null,
    "verification_notes": null,
    "created_at": "2025-07-19T19:56:11.965575+00:00",
    "updated_at": "2025-07-19T19:56:11.965575+00:00",
    "benchmark_name": "AIME 2024"
  },
  {
    "model_benchmark_id": 691,
    "benchmark_id": "aime-2025",
    "model_id": "qwen3-30b-a3b",
    "score": 0.709,
    "normalized_score": 0.709,
    "is_self_reported": true,
    "self_reported_source_link": "https://qwenlm.github.io/blog/qwen3/",
    "verified_by_llmstats": false,
    "analysis_method": "Accuracy",
    "verification_provider_id": null,
    "verification_hardware": null,
    "verification_date": null,
    "verification_notes": null,
    "created_at": "2025-07-19T19:56:12.449947+00:00",
    "updated_at": "2025-07-19T19:56:12.449947+00:00",
    "benchmark_name": "AIME 2025"
  },
  {
    "model_benchmark_id": 1454,
    "benchmark_id": "arena-hard",
    "model_id": "qwen3-30b-a3b",
    "score": 0.91,
    "normalized_score": 0.91,
    "is_self_reported": true,
    "self_reported_source_link": "https://qwenlm.github.io/blog/qwen3/",
    "verified_by_llmstats": false,
    "analysis_method": "Accuracy",
    "verification_provider_id": null,
    "verification_hardware": null,
    "verification_date": null,
    "verification_notes": null,
    "created_at": "2025-07-19T19:56:14.098594+00:00",
    "updated_at": "2025-07-19T19:56:14.098594+00:00",
    "benchmark_name": "Arena Hard"
  },
  {
    "model_benchmark_id": 852,
    "benchmark_id": "bfcl",
    "model_id": "qwen3-30b-a3b",
    "score": 0.691,
    "normalized_score": 0.691,
    "is_self_reported": true,
    "self_reported_source_link": "https://qwenlm.github.io/blog/qwen3/",
    "verified_by_llmstats": false,
    "analysis_method": "v3",
    "verification_provider_id": null,
    "verification_hardware": null,
    "verification_date": null,
    "verification_notes": null,
    "created_at": "2025-07-19T19:56:12.782049+00:00",
    "updated_at": "2025-07-19T19:56:12.782049+00:00",
    "benchmark_name": "BFCL"
  },
  {
    "model_benchmark_id": 304,
    "benchmark_id": "gpqa",
    "model_id": "qwen3-30b-a3b",
    "score": 0.658,
    "normalized_score": 0.658,
    "is_self_reported": true,
    "self_reported_source_link": "https://qwenlm.github.io/blog/qwen3/",
    "verified_by_llmstats": false,
    "analysis_method": "Accuracy",
    "verification_provider_id": null,
    "verification_hardware": null,
    "verification_date": null,
    "verification_notes": null,
    "created_at": "2025-07-19T19:56:11.682771+00:00",
    "updated_at": "2025-07-19T19:56:11.682771+00:00",
    "benchmark_name": "GPQA"
  },
  {
    "model_benchmark_id": 751,
    "benchmark_id": "livebench",
    "model_id": "qwen3-30b-a3b",
    "score": 0.743,
    "normalized_score": 0.743,
    "is_self_reported": true,
    "self_reported_source_link": "https://qwenlm.github.io/blog/qwen3/",
    "verified_by_llmstats": false,
    "analysis_method": "Accuracy",
    "verification_provider_id": null,
    "verification_hardware": null,
    "verification_date": null,
    "verification_notes": null,
    "created_at": "2025-07-19T19:56:12.579527+00:00",
    "updated_at": "2025-07-19T19:56:12.579527+00:00",
    "benchmark_name": "LiveBench"
  },
  {
    "model_benchmark_id": 1125,
    "benchmark_id": "livecodebench",
    "model_id": "qwen3-30b-a3b",
    "score": 0.626,
    "normalized_score": 0.626,
    "is_self_reported": true,
    "self_reported_source_link": "https://qwenlm.github.io/blog/qwen3/",
    "verified_by_llmstats": false,
    "analysis_method": "v5",
    "verification_provider_id": null,
    "verification_hardware": null,
    "verification_date": null,
    "verification_notes": null,
    "created_at": "2025-07-19T19:56:13.349221+00:00",
    "updated_at": "2025-07-19T19:56:13.349221+00:00",
    "benchmark_name": "LiveCodeBench"
  },
  {
    "model_benchmark_id": 1649,
    "benchmark_id": "multi-if",
    "model_id": "qwen3-30b-a3b",
    "score": 0.722,
    "normalized_score": 0.722,
    "is_self_reported": true,
    "self_reported_source_link": "https://qwenlm.github.io/blog/qwen3/",
    "verified_by_llmstats": false,
    "analysis_method": "Accuracy",
    "verification_provider_id": null,
    "verification_hardware": null,
    "verification_date": null,
    "verification_notes": null,
    "created_at": "2025-07-19T19:56:14.641584+00:00",
    "updated_at": "2025-07-19T19:56:14.641584+00:00",
    "benchmark_name": "Multi-IF"
  }
]