[
  {
    "model_benchmark_id": 448,
    "benchmark_id": "aime-2024",
    "model_id": "gemini-2.0-flash-thinking",
    "score": 0.733,
    "normalized_score": 0.733,
    "is_self_reported": true,
    "self_reported_source_link": "https://ai.google.dev/gemini-api/docs/models/gemini#evaluation",
    "verified_by_llmstats": false,
    "analysis_method": "Enhanced reasoning on competition-level math prompts",
    "verification_provider_id": null,
    "verification_hardware": null,
    "verification_date": null,
    "verification_notes": null,
    "created_at": "2025-07-19T19:56:11.952263+00:00",
    "updated_at": "2025-07-19T19:56:11.952263+00:00",
    "benchmark_name": "AIME 2024"
  },
  {
    "model_benchmark_id": 271,
    "benchmark_id": "gpqa",
    "model_id": "gemini-2.0-flash-thinking",
    "score": 0.742,
    "normalized_score": 0.742,
    "is_self_reported": true,
    "self_reported_source_link": "https://ai.google.dev/gemini-api/docs/models/gemini#evaluation",
    "verified_by_llmstats": false,
    "analysis_method": "Challenging science questions requiring chain-of-thought reasoning",
    "verification_provider_id": null,
    "verification_hardware": null,
    "verification_date": null,
    "verification_notes": null,
    "created_at": "2025-07-19T19:56:11.620752+00:00",
    "updated_at": "2025-07-19T19:56:11.620752+00:00",
    "benchmark_name": "GPQA"
  },
  {
    "model_benchmark_id": 559,
    "benchmark_id": "mmmu",
    "model_id": "gemini-2.0-flash-thinking",
    "score": 0.754,
    "normalized_score": 0.754,
    "is_self_reported": true,
    "self_reported_source_link": "https://ai.google.dev/gemini-api/docs/models/gemini#evaluation",
    "verified_by_llmstats": false,
    "analysis_method": "Image-text QA across various domains",
    "verification_provider_id": null,
    "verification_hardware": null,
    "verification_date": null,
    "verification_notes": null,
    "created_at": "2025-07-19T19:56:12.151038+00:00",
    "updated_at": "2025-07-19T19:56:12.151038+00:00",
    "benchmark_name": "MMMU"
  }
]