[
  {
    "model_benchmark_id": 478,
    "benchmark_id": "aime-2024",
    "model_id": "claude-3-7-sonnet-20250219",
    "score": 0.8,
    "normalized_score": 0.8,
    "is_self_reported": true,
    "self_reported_source_link": "https://www.anthropic.com/news/claude-3-7-sonnet",
    "verified_by_llmstats": false,
    "analysis_method": "",
    "verification_provider_id": null,
    "verification_hardware": null,
    "verification_date": null,
    "verification_notes": null,
    "created_at": "2025-07-19T19:56:12.007831+00:00",
    "updated_at": "2025-07-19T19:56:12.007831+00:00",
    "benchmark_name": "AIME 2024"
  },
  {
    "model_benchmark_id": 700,
    "benchmark_id": "aime-2025",
    "model_id": "claude-3-7-sonnet-20250219",
    "score": 0.548,
    "normalized_score": 0.548,
    "is_self_reported": true,
    "self_reported_source_link": "https://www.anthropic.com/news/claude-4",
    "verified_by_llmstats": false,
    "analysis_method": "Parallel test-time compute (footnotes 4, 5)",
    "verification_provider_id": null,
    "verification_hardware": null,
    "verification_date": null,
    "verification_notes": null,
    "created_at": "2025-07-19T19:56:12.464908+00:00",
    "updated_at": "2025-07-19T19:56:12.464908+00:00",
    "benchmark_name": "AIME 2025"
  },
  {
    "model_benchmark_id": 332,
    "benchmark_id": "gpqa",
    "model_id": "claude-3-7-sonnet-20250219",
    "score": 0.848,
    "normalized_score": 0.848,
    "is_self_reported": true,
    "self_reported_source_link": "https://www.anthropic.com/news/claude-3-7-sonnet",
    "verified_by_llmstats": false,
    "analysis_method": "Diamond",
    "verification_provider_id": null,
    "verification_hardware": null,
    "verification_date": null,
    "verification_notes": null,
    "created_at": "2025-07-19T19:56:11.727330+00:00",
    "updated_at": "2025-07-19T19:56:11.727330+00:00",
    "benchmark_name": "GPQA"
  },
  {
    "model_benchmark_id": 629,
    "benchmark_id": "ifeval",
    "model_id": "claude-3-7-sonnet-20250219",
    "score": 0.932,
    "normalized_score": 0.932,
    "is_self_reported": true,
    "self_reported_source_link": "https://www.anthropic.com/news/claude-3-7-sonnet",
    "verified_by_llmstats": false,
    "analysis_method": "",
    "verification_provider_id": null,
    "verification_hardware": null,
    "verification_date": null,
    "verification_notes": null,
    "created_at": "2025-07-19T19:56:12.294010+00:00",
    "updated_at": "2025-07-19T19:56:12.294010+00:00",
    "benchmark_name": "IFEval"
  },
  {
    "model_benchmark_id": 512,
    "benchmark_id": "math-500",
    "model_id": "claude-3-7-sonnet-20250219",
    "score": 0.962,
    "normalized_score": 0.962,
    "is_self_reported": true,
    "self_reported_source_link": "https://www.anthropic.com/news/claude-3-7-sonnet",
    "verified_by_llmstats": false,
    "analysis_method": "",
    "verification_provider_id": null,
    "verification_hardware": null,
    "verification_date": null,
    "verification_notes": null,
    "created_at": "2025-07-19T19:56:12.063685+00:00",
    "updated_at": "2025-07-19T19:56:12.063685+00:00",
    "benchmark_name": "MATH-500"
  },
  {
    "model_benchmark_id": 1478,
    "benchmark_id": "mmmlu",
    "model_id": "claude-3-7-sonnet-20250219",
    "score": 0.861,
    "normalized_score": 0.861,
    "is_self_reported": true,
    "self_reported_source_link": "https://www.anthropic.com/news/claude-3-7-sonnet",
    "verified_by_llmstats": false,
    "analysis_method": "Average over 14 non-English languages (footnote 3)",
    "verification_provider_id": null,
    "verification_hardware": null,
    "verification_date": null,
    "verification_notes": null,
    "created_at": "2025-07-19T19:56:14.152773+00:00",
    "updated_at": "2025-07-19T19:56:14.152773+00:00",
    "benchmark_name": "MMMLU"
  },
  {
    "model_benchmark_id": 582,
    "benchmark_id": "mmmu",
    "model_id": "claude-3-7-sonnet-20250219",
    "score": 0.75,
    "normalized_score": 0.75,
    "is_self_reported": true,
    "self_reported_source_link": "https://www.anthropic.com/news/claude-3-7-sonnet",
    "verified_by_llmstats": false,
    "analysis_method": "validation",
    "verification_provider_id": null,
    "verification_hardware": null,
    "verification_date": null,
    "verification_notes": null,
    "created_at": "2025-07-19T19:56:12.197283+00:00",
    "updated_at": "2025-07-19T19:56:12.197283+00:00",
    "benchmark_name": "MMMU"
  },
  {
    "model_benchmark_id": 1348,
    "benchmark_id": "swe-bench-verified",
    "model_id": "claude-3-7-sonnet-20250219",
    "score": 0.703,
    "normalized_score": 0.703,
    "is_self_reported": true,
    "self_reported_source_link": "https://www.anthropic.com/news/claude-3-7-sonnet",
    "verified_by_llmstats": false,
    "analysis_method": "With multiple parallel attempts and advanced scaffolding",
    "verification_provider_id": null,
    "verification_hardware": null,
    "verification_date": null,
    "verification_notes": null,
    "created_at": "2025-07-19T19:56:13.838599+00:00",
    "updated_at": "2025-07-19T19:56:13.838599+00:00",
    "benchmark_name": "SWE-Bench Verified"
  },
  {
    "model_benchmark_id": 1772,
    "benchmark_id": "tau-bench-airline",
    "model_id": "claude-3-7-sonnet-20250219",
    "score": 0.584,
    "normalized_score": 0.584,
    "is_self_reported": true,
    "self_reported_source_link": "https://www.anthropic.com/news/claude-3-7-sonnet",
    "verified_by_llmstats": false,
    "analysis_method": "With prompt addendum to better utilize planning",
    "verification_provider_id": null,
    "verification_hardware": null,
    "verification_date": null,
    "verification_notes": null,
    "created_at": "2025-07-19T19:56:14.999875+00:00",
    "updated_at": "2025-07-19T19:56:14.999875+00:00",
    "benchmark_name": "TAU-bench Airline"
  },
  {
    "model_benchmark_id": 1758,
    "benchmark_id": "tau-bench-retail",
    "model_id": "claude-3-7-sonnet-20250219",
    "score": 0.812,
    "normalized_score": 0.812,
    "is_self_reported": true,
    "self_reported_source_link": "https://www.anthropic.com/news/claude-3-7-sonnet",
    "verified_by_llmstats": false,
    "analysis_method": "With prompt addendum to better utilize planning",
    "verification_provider_id": null,
    "verification_hardware": null,
    "verification_date": null,
    "verification_notes": null,
    "created_at": "2025-07-19T19:56:14.971988+00:00",
    "updated_at": "2025-07-19T19:56:14.971988+00:00",
    "benchmark_name": "TAU-bench Retail"
  },
  {
    "model_benchmark_id": 653,
    "benchmark_id": "terminal-bench",
    "model_id": "claude-3-7-sonnet-20250219",
    "score": 0.352,
    "normalized_score": 0.352,
    "is_self_reported": true,
    "self_reported_source_link": "https://www.anthropic.com/news/claude-4",
    "verified_by_llmstats": false,
    "analysis_method": "Parallel test-time compute, Claude Code agent framework (footnotes 2, 5)",
    "verification_provider_id": null,
    "verification_hardware": null,
    "verification_date": null,
    "verification_notes": null,
    "created_at": "2025-07-19T19:56:12.350298+00:00",
    "updated_at": "2025-07-19T19:56:12.350298+00:00",
    "benchmark_name": "Terminal-bench"
  }
]