[
  {
    "model_benchmark_id": 487,
    "benchmark_id": "aime-2024",
    "model_id": "o1-pro",
    "score": 0.86,
    "normalized_score": 0.86,
    "is_self_reported": true,
    "self_reported_source_link": "https://openai.com/index/introducing-chatgpt-pro/",
    "verified_by_llmstats": false,
    "analysis_method": "Pass@1 accuracy",
    "verification_provider_id": null,
    "verification_hardware": null,
    "verification_date": null,
    "verification_notes": null,
    "created_at": "2025-07-19T19:56:12.021363+00:00",
    "updated_at": "2025-07-19T19:56:12.021363+00:00",
    "benchmark_name": "AIME 2024"
  },
  {
    "model_benchmark_id": 354,
    "benchmark_id": "gpqa",
    "model_id": "o1-pro",
    "score": 0.79,
    "normalized_score": 0.79,
    "is_self_reported": true,
    "self_reported_source_link": "https://openai.com/index/introducing-chatgpt-pro/",
    "verified_by_llmstats": false,
    "analysis_method": "Diamond, Pass@1 accuracy",
    "verification_provider_id": null,
    "verification_hardware": null,
    "verification_date": null,
    "verification_notes": null,
    "created_at": "2025-07-19T19:56:11.762804+00:00",
    "updated_at": "2025-07-19T19:56:11.762804+00:00",
    "benchmark_name": "GPQA"
  }
]