[
  {
    "model_benchmark_id": 1148,
    "benchmark_id": "bird-sql-(dev)",
    "model_id": "gemini-2.0-flash-lite",
    "score": 0.574,
    "normalized_score": 0.574,
    "is_self_reported": true,
    "self_reported_source_link": "https://ai.google.dev/gemini-api/docs/models",
    "verified_by_llmstats": false,
    "analysis_method": "- evaluation",
    "verification_provider_id": null,
    "verification_hardware": null,
    "verification_date": null,
    "verification_notes": null,
    "created_at": "2025-07-19T19:56:13.415349+00:00",
    "updated_at": "2025-07-19T19:56:13.415349+00:00",
    "benchmark_name": "Bird-SQL (dev)"
  },
  {
    "model_benchmark_id": 1403,
    "benchmark_id": "covost2",
    "model_id": "gemini-2.0-flash-lite",
    "score": 0.384,
    "normalized_score": 0.384,
    "is_self_reported": true,
    "self_reported_source_link": "https://ai.google.dev/gemini-api/docs/models",
    "verified_by_llmstats": false,
    "analysis_method": "Automatic speech translation (BLEU score) across 21 languages",
    "verification_provider_id": null,
    "verification_hardware": null,
    "verification_date": null,
    "verification_notes": null,
    "created_at": "2025-07-19T19:56:13.960537+00:00",
    "updated_at": "2025-07-19T19:56:13.960537+00:00",
    "benchmark_name": "CoVoST2"
  },
  {
    "model_benchmark_id": 921,
    "benchmark_id": "egoschema",
    "model_id": "gemini-2.0-flash-lite",
    "score": 0.672,
    "normalized_score": 0.672,
    "is_self_reported": true,
    "self_reported_source_link": "https://ai.google.dev/gemini-api/docs/models",
    "verified_by_llmstats": false,
    "analysis_method": "Video analysis across multiple domains",
    "verification_provider_id": null,
    "verification_hardware": null,
    "verification_date": null,
    "verification_notes": null,
    "created_at": "2025-07-19T19:56:12.924659+00:00",
    "updated_at": "2025-07-19T19:56:12.924659+00:00",
    "benchmark_name": "EgoSchema"
  },
  {
    "model_benchmark_id": 1088,
    "benchmark_id": "facts-grounding",
    "model_id": "gemini-2.0-flash-lite",
    "score": 0.836,
    "normalized_score": 0.836,
    "is_self_reported": true,
    "self_reported_source_link": "https://ai.google.dev/gemini-api/docs/models",
    "verified_by_llmstats": false,
    "analysis_method": "- evaluation",
    "verification_provider_id": null,
    "verification_hardware": null,
    "verification_date": null,
    "verification_notes": null,
    "created_at": "2025-07-19T19:56:13.264333+00:00",
    "updated_at": "2025-07-19T19:56:13.264333+00:00",
    "benchmark_name": "FACTS Grounding"
  },
  {
    "model_benchmark_id": 1209,
    "benchmark_id": "global-mmlu-lite",
    "model_id": "gemini-2.0-flash-lite",
    "score": 0.782,
    "normalized_score": 0.782,
    "is_self_reported": true,
    "self_reported_source_link": "https://ai.google.dev/gemini-api/docs/models",
    "verified_by_llmstats": false,
    "analysis_method": "0-shot evaluation",
    "verification_provider_id": null,
    "verification_hardware": null,
    "verification_date": null,
    "verification_notes": null,
    "created_at": "2025-07-19T19:56:13.543616+00:00",
    "updated_at": "2025-07-19T19:56:13.543616+00:00",
    "benchmark_name": "Global-MMLU-Lite"
  },
  {
    "model_benchmark_id": 266,
    "benchmark_id": "gpqa",
    "model_id": "gemini-2.0-flash-lite",
    "score": 0.515,
    "normalized_score": 0.515,
    "is_self_reported": true,
    "self_reported_source_link": "https://ai.google.dev/gemini-api/docs/models",
    "verified_by_llmstats": false,
    "analysis_method": "Diamond",
    "verification_provider_id": null,
    "verification_hardware": null,
    "verification_date": null,
    "verification_notes": null,
    "created_at": "2025-07-19T19:56:11.611234+00:00",
    "updated_at": "2025-07-19T19:56:11.611234+00:00",
    "benchmark_name": "GPQA"
  },
  {
    "model_benchmark_id": 1156,
    "benchmark_id": "hiddenmath",
    "model_id": "gemini-2.0-flash-lite",
    "score": 0.553,
    "normalized_score": 0.553,
    "is_self_reported": true,
    "self_reported_source_link": "https://ai.google.dev/gemini-api/docs/models",
    "verified_by_llmstats": false,
    "analysis_method": "0-shot evaluation",
    "verification_provider_id": null,
    "verification_hardware": null,
    "verification_date": null,
    "verification_notes": null,
    "created_at": "2025-07-19T19:56:13.433332+00:00",
    "updated_at": "2025-07-19T19:56:13.433332+00:00",
    "benchmark_name": "HiddenMath"
  },
  {
    "model_benchmark_id": 1320,
    "benchmark_id": "livecodebench-v5",
    "model_id": "gemini-2.0-flash-lite",
    "score": 0.289,
    "normalized_score": 0.289,
    "is_self_reported": true,
    "self_reported_source_link": "https://ai.google.dev/gemini-api/docs/models",
    "verified_by_llmstats": false,
    "analysis_method": "Pass@1",
    "verification_provider_id": null,
    "verification_hardware": null,
    "verification_date": null,
    "verification_notes": null,
    "created_at": "2025-07-19T19:56:13.771288+00:00",
    "updated_at": "2025-07-19T19:56:13.771288+00:00",
    "benchmark_name": "LiveCodeBench v5"
  },
  {
    "model_benchmark_id": 379,
    "benchmark_id": "math",
    "model_id": "gemini-2.0-flash-lite",
    "score": 0.868,
    "normalized_score": 0.868,
    "is_self_reported": true,
    "self_reported_source_link": "https://ai.google.dev/gemini-api/docs/models",
    "verified_by_llmstats": false,
    "analysis_method": "standard",
    "verification_provider_id": null,
    "verification_hardware": null,
    "verification_date": null,
    "verification_notes": null,
    "created_at": "2025-07-19T19:56:11.819524+00:00",
    "updated_at": "2025-07-19T19:56:11.819524+00:00",
    "benchmark_name": "MATH"
  },
  {
    "model_benchmark_id": 166,
    "benchmark_id": "mmlu-pro",
    "model_id": "gemini-2.0-flash-lite",
    "score": 0.716,
    "normalized_score": 0.716,
    "is_self_reported": true,
    "self_reported_source_link": "https://developers.googleblog.com/en/gemini-2-family-expands/",
    "verified_by_llmstats": false,
    "analysis_method": "Chain-of-Thought accuracy",
    "verification_provider_id": null,
    "verification_hardware": null,
    "verification_date": null,
    "verification_notes": null,
    "created_at": "2025-07-19T19:56:11.423223+00:00",
    "updated_at": "2025-07-19T19:56:11.423223+00:00",
    "benchmark_name": "MMLU-Pro"
  },
  {
    "model_benchmark_id": 554,
    "benchmark_id": "mmmu",
    "model_id": "gemini-2.0-flash-lite",
    "score": 0.68,
    "normalized_score": 0.68,
    "is_self_reported": true,
    "self_reported_source_link": "https://ai.google.dev/gemini-api/docs/models",
    "verified_by_llmstats": false,
    "analysis_method": "Multi-discipline college-level multimodal understanding and reasoning problems",
    "verification_provider_id": null,
    "verification_hardware": null,
    "verification_date": null,
    "verification_notes": null,
    "created_at": "2025-07-19T19:56:12.141505+00:00",
    "updated_at": "2025-07-19T19:56:12.141505+00:00",
    "benchmark_name": "MMMU"
  },
  {
    "model_benchmark_id": 1402,
    "benchmark_id": "mrcr-1m",
    "model_id": "gemini-2.0-flash-lite",
    "score": 0.58,
    "normalized_score": 0.58,
    "is_self_reported": true,
    "self_reported_source_link": "https://ai.google.dev/gemini-api/docs/models",
    "verified_by_llmstats": false,
    "analysis_method": "Long-context comprehension accuracy",
    "verification_provider_id": null,
    "verification_hardware": null,
    "verification_date": null,
    "verification_notes": null,
    "created_at": "2025-07-19T19:56:13.956748+00:00",
    "updated_at": "2025-07-19T19:56:13.956748+00:00",
    "benchmark_name": "MRCR 1M"
  },
  {
    "model_benchmark_id": 226,
    "benchmark_id": "simpleqa",
    "model_id": "gemini-2.0-flash-lite",
    "score": 0.217,
    "normalized_score": 0.217,
    "is_self_reported": true,
    "self_reported_source_link": "https://ai.google.dev/gemini-api/docs/models",
    "verified_by_llmstats": false,
    "analysis_method": "Factuality",
    "verification_provider_id": null,
    "verification_hardware": null,
    "verification_date": null,
    "verification_notes": null,
    "created_at": "2025-07-19T19:56:11.535234+00:00",
    "updated_at": "2025-07-19T19:56:11.535234+00:00",
    "benchmark_name": "SimpleQA"
  }
]