[
  {
    "model_benchmark_id": 475,
    "benchmark_id": "aime-2024",
    "model_id": "grok-3",
    "score": 0.933,
    "normalized_score": 0.933,
    "is_self_reported": true,
    "self_reported_source_link": "https://x.ai/blog/grok-3",
    "verified_by_llmstats": false,
    "analysis_method": "accuracy",
    "verification_provider_id": null,
    "verification_hardware": null,
    "verification_date": null,
    "verification_notes": null,
    "created_at": "2025-07-19T19:56:12.003392+00:00",
    "updated_at": "2025-07-19T19:56:12.003392+00:00",
    "benchmark_name": "AIME 2024"
  },
  {
    "model_benchmark_id": 696,
    "benchmark_id": "aime-2025",
    "model_id": "grok-3",
    "score": 0.933,
    "normalized_score": 0.933,
    "is_self_reported": true,
    "self_reported_source_link": "https://x.ai/blog/grok-3",
    "verified_by_llmstats": false,
    "analysis_method": "accuracy",
    "verification_provider_id": null,
    "verification_hardware": null,
    "verification_date": null,
    "verification_notes": null,
    "created_at": "2025-07-19T19:56:12.457788+00:00",
    "updated_at": "2025-07-19T19:56:12.457788+00:00",
    "benchmark_name": "AIME 2025"
  },
  {
    "model_benchmark_id": 324,
    "benchmark_id": "gpqa",
    "model_id": "grok-3",
    "score": 0.846,
    "normalized_score": 0.846,
    "is_self_reported": true,
    "self_reported_source_link": "https://x.ai/blog/grok-3",
    "verified_by_llmstats": false,
    "analysis_method": "accuracy",
    "verification_provider_id": null,
    "verification_hardware": null,
    "verification_date": null,
    "verification_notes": null,
    "created_at": "2025-07-19T19:56:11.714708+00:00",
    "updated_at": "2025-07-19T19:56:11.714708+00:00",
    "benchmark_name": "GPQA"
  },
  {
    "model_benchmark_id": 1142,
    "benchmark_id": "livecodebench",
    "model_id": "grok-3",
    "score": 0.794,
    "normalized_score": 0.794,
    "is_self_reported": true,
    "self_reported_source_link": "https://x.ai/blog/grok-3",
    "verified_by_llmstats": false,
    "analysis_method": "accuracy",
    "verification_provider_id": null,
    "verification_hardware": null,
    "verification_date": null,
    "verification_notes": null,
    "created_at": "2025-07-19T19:56:13.402422+00:00",
    "updated_at": "2025-07-19T19:56:13.402422+00:00",
    "benchmark_name": "LiveCodeBench"
  },
  {
    "model_benchmark_id": 579,
    "benchmark_id": "mmmu",
    "model_id": "grok-3",
    "score": 0.78,
    "normalized_score": 0.78,
    "is_self_reported": true,
    "self_reported_source_link": "https://x.ai/blog/grok-3",
    "verified_by_llmstats": false,
    "analysis_method": "accuracy",
    "verification_provider_id": null,
    "verification_hardware": null,
    "verification_date": null,
    "verification_notes": null,
    "created_at": "2025-07-19T19:56:12.191844+00:00",
    "updated_at": "2025-07-19T19:56:12.191844+00:00",
    "benchmark_name": "MMMU"
  }
]