[
  {
    "model_benchmark_id": 465,
    "benchmark_id": "aime-2024",
    "model_id": "deepseek-r1-distill-llama-8b",
    "score": 0.8,
    "normalized_score": 0.8,
    "is_self_reported": true,
    "self_reported_source_link": "https://huggingface.co/deepseek-ai/DeepSeek-R1-Distill-Llama-8B",
    "verified_by_llmstats": false,
    "analysis_method": "Cons@64",
    "verification_provider_id": null,
    "verification_hardware": null,
    "verification_date": null,
    "verification_notes": null,
    "created_at": "2025-07-19T19:56:11.984093+00:00",
    "updated_at": "2025-07-19T19:56:11.985582+00:00",
    "benchmark_name": "AIME 2024"
  },
  {
    "model_benchmark_id": 314,
    "benchmark_id": "gpqa",
    "model_id": "deepseek-r1-distill-llama-8b",
    "score": 0.49,
    "normalized_score": 0.49,
    "is_self_reported": true,
    "self_reported_source_link": "https://huggingface.co/deepseek-ai/DeepSeek-R1-Distill-Llama-8B",
    "verified_by_llmstats": false,
    "analysis_method": "Diamond, Pass@1",
    "verification_provider_id": null,
    "verification_hardware": null,
    "verification_date": null,
    "verification_notes": null,
    "created_at": "2025-07-19T19:56:11.699365+00:00",
    "updated_at": "2025-07-19T19:56:11.699365+00:00",
    "benchmark_name": "GPQA"
  },
  {
    "model_benchmark_id": 1134,
    "benchmark_id": "livecodebench",
    "model_id": "deepseek-r1-distill-llama-8b",
    "score": 0.396,
    "normalized_score": 0.396,
    "is_self_reported": true,
    "self_reported_source_link": "https://huggingface.co/deepseek-ai/DeepSeek-R1-Distill-Llama-8B",
    "verified_by_llmstats": false,
    "analysis_method": "Pass@1",
    "verification_provider_id": null,
    "verification_hardware": null,
    "verification_date": null,
    "verification_notes": null,
    "created_at": "2025-07-19T19:56:13.384499+00:00",
    "updated_at": "2025-07-19T19:56:13.384499+00:00",
    "benchmark_name": "LiveCodeBench"
  },
  {
    "model_benchmark_id": 502,
    "benchmark_id": "math-500",
    "model_id": "deepseek-r1-distill-llama-8b",
    "score": 0.891,
    "normalized_score": 0.891,
    "is_self_reported": true,
    "self_reported_source_link": "https://huggingface.co/deepseek-ai/DeepSeek-R1-Distill-Llama-8B",
    "verified_by_llmstats": false,
    "analysis_method": "Pass@1",
    "verification_provider_id": null,
    "verification_hardware": null,
    "verification_date": null,
    "verification_notes": null,
    "created_at": "2025-07-19T19:56:12.046427+00:00",
    "updated_at": "2025-07-19T19:56:12.046427+00:00",
    "benchmark_name": "MATH-500"
  }
]