[
  {
    "model_benchmark_id": 1436,
    "benchmark_id": "aime",
    "model_id": "phi-4-mini-reasoning",
    "score": 0.575,
    "normalized_score": 0.575,
    "is_self_reported": true,
    "self_reported_source_link": "https://huggingface.co/microsoft/Phi-4-mini-reasoning",
    "verified_by_llmstats": false,
    "analysis_method": "Standard evaluation",
    "verification_provider_id": null,
    "verification_hardware": null,
    "verification_date": null,
    "verification_notes": null,
    "created_at": "2025-07-19T19:56:14.061299+00:00",
    "updated_at": "2025-07-19T19:56:14.061299+00:00",
    "benchmark_name": "AIME"
  },
  {
    "model_benchmark_id": 281,
    "benchmark_id": "gpqa",
    "model_id": "phi-4-mini-reasoning",
    "score": 0.52,
    "normalized_score": 0.52,
    "is_self_reported": true,
    "self_reported_source_link": "https://huggingface.co/microsoft/Phi-4-mini-reasoning",
    "verified_by_llmstats": false,
    "analysis_method": "Diamond",
    "verification_provider_id": null,
    "verification_hardware": null,
    "verification_date": null,
    "verification_notes": null,
    "created_at": "2025-07-19T19:56:11.642870+00:00",
    "updated_at": "2025-07-19T19:56:11.642870+00:00",
    "benchmark_name": "GPQA"
  },
  {
    "model_benchmark_id": 494,
    "benchmark_id": "math-500",
    "model_id": "phi-4-mini-reasoning",
    "score": 0.946,
    "normalized_score": 0.946,
    "is_self_reported": true,
    "self_reported_source_link": "https://huggingface.co/microsoft/Phi-4-mini-reasoning",
    "verified_by_llmstats": false,
    "analysis_method": "Standard evaluation",
    "verification_provider_id": null,
    "verification_hardware": null,
    "verification_date": null,
    "verification_notes": null,
    "created_at": "2025-07-19T19:56:12.032863+00:00",
    "updated_at": "2025-07-19T19:56:12.032863+00:00",
    "benchmark_name": "MATH-500"
  }
]