[
  {
    "model_benchmark_id": 958,
    "benchmark_id": "drop",
    "model_id": "claude-3-5-haiku-20241022",
    "score": 0.831,
    "normalized_score": 0.831,
    "is_self_reported": true,
    "self_reported_source_link": "https://www.anthropic.com/news/claude-3-5-haiku",
    "verified_by_llmstats": false,
    "analysis_method": "3-shot F1 Score",
    "verification_provider_id": null,
    "verification_hardware": null,
    "verification_date": null,
    "verification_notes": null,
    "created_at": "2025-07-19T19:56:13.017079+00:00",
    "updated_at": "2025-07-19T19:56:13.017079+00:00",
    "benchmark_name": "DROP"
  },
  {
    "model_benchmark_id": 331,
    "benchmark_id": "gpqa",
    "model_id": "claude-3-5-haiku-20241022",
    "score": 0.416,
    "normalized_score": 0.416,
    "is_self_reported": true,
    "self_reported_source_link": "https://www.anthropic.com/news/claude-3-5-haiku",
    "verified_by_llmstats": false,
    "analysis_method": "0-shot CoT",
    "verification_provider_id": null,
    "verification_hardware": null,
    "verification_date": null,
    "verification_notes": null,
    "created_at": "2025-07-19T19:56:11.725835+00:00",
    "updated_at": "2025-07-19T19:56:11.725835+00:00",
    "benchmark_name": "GPQA"
  },
  {
    "model_benchmark_id": 801,
    "benchmark_id": "humaneval",
    "model_id": "claude-3-5-haiku-20241022",
    "score": 0.881,
    "normalized_score": 0.881,
    "is_self_reported": true,
    "self_reported_source_link": "https://www.anthropic.com/news/claude-3-5-haiku",
    "verified_by_llmstats": false,
    "analysis_method": "0-shot",
    "verification_provider_id": null,
    "verification_hardware": null,
    "verification_date": null,
    "verification_notes": null,
    "created_at": "2025-07-19T19:56:12.671817+00:00",
    "updated_at": "2025-07-19T19:56:12.671817+00:00",
    "benchmark_name": "HumanEval"
  },
  {
    "model_benchmark_id": 417,
    "benchmark_id": "math",
    "model_id": "claude-3-5-haiku-20241022",
    "score": 0.694,
    "normalized_score": 0.694,
    "is_self_reported": true,
    "self_reported_source_link": "https://www.anthropic.com/news/claude-3-5-haiku",
    "verified_by_llmstats": false,
    "analysis_method": "0-shot CoT",
    "verification_provider_id": null,
    "verification_hardware": null,
    "verification_date": null,
    "verification_notes": null,
    "created_at": "2025-07-19T19:56:11.885732+00:00",
    "updated_at": "2025-07-19T19:56:11.885732+00:00",
    "benchmark_name": "MATH"
  },
  {
    "model_benchmark_id": 1292,
    "benchmark_id": "mgsm",
    "model_id": "claude-3-5-haiku-20241022",
    "score": 0.856,
    "normalized_score": 0.856,
    "is_self_reported": true,
    "self_reported_source_link": "https://www.anthropic.com/news/claude-3-5-haiku",
    "verified_by_llmstats": false,
    "analysis_method": "0-shot CoT",
    "verification_provider_id": null,
    "verification_hardware": null,
    "verification_date": null,
    "verification_notes": null,
    "created_at": "2025-07-19T19:56:13.705114+00:00",
    "updated_at": "2025-07-19T19:56:13.705114+00:00",
    "benchmark_name": "MGSM"
  },
  {
    "model_benchmark_id": 210,
    "benchmark_id": "mmlu-pro",
    "model_id": "claude-3-5-haiku-20241022",
    "score": 0.65,
    "normalized_score": 0.65,
    "is_self_reported": true,
    "self_reported_source_link": "https://www.anthropic.com/news/claude-3-5-haiku",
    "verified_by_llmstats": false,
    "analysis_method": "0-shot CoT",
    "verification_provider_id": null,
    "verification_hardware": null,
    "verification_date": null,
    "verification_notes": null,
    "created_at": "2025-07-19T19:56:11.499754+00:00",
    "updated_at": "2025-07-19T19:56:11.499754+00:00",
    "benchmark_name": "MMLU-Pro"
  },
  {
    "model_benchmark_id": 1347,
    "benchmark_id": "swe-bench-verified",
    "model_id": "claude-3-5-haiku-20241022",
    "score": 0.406,
    "normalized_score": 0.406,
    "is_self_reported": true,
    "self_reported_source_link": "https://www.anthropic.com/news/claude-3-5-haiku",
    "verified_by_llmstats": false,
    "analysis_method": "standard",
    "verification_provider_id": null,
    "verification_hardware": null,
    "verification_date": null,
    "verification_notes": null,
    "created_at": "2025-07-19T19:56:13.836974+00:00",
    "updated_at": "2025-07-19T19:56:13.836974+00:00",
    "benchmark_name": "SWE-Bench Verified"
  },
  {
    "model_benchmark_id": 1771,
    "benchmark_id": "tau-bench-airline",
    "model_id": "claude-3-5-haiku-20241022",
    "score": 0.228,
    "normalized_score": 0.228,
    "is_self_reported": true,
    "self_reported_source_link": "https://www.anthropic.com/news/claude-3-5-haiku",
    "verified_by_llmstats": false,
    "analysis_method": "standard",
    "verification_provider_id": null,
    "verification_hardware": null,
    "verification_date": null,
    "verification_notes": null,
    "created_at": "2025-07-19T19:56:14.997081+00:00",
    "updated_at": "2025-07-19T19:56:14.997081+00:00",
    "benchmark_name": "TAU-bench Airline"
  },
  {
    "model_benchmark_id": 1757,
    "benchmark_id": "tau-bench-retail",
    "model_id": "claude-3-5-haiku-20241022",
    "score": 0.51,
    "normalized_score": 0.51,
    "is_self_reported": true,
    "self_reported_source_link": "https://www.anthropic.com/news/claude-3-5-haiku",
    "verified_by_llmstats": false,
    "analysis_method": "standard",
    "verification_provider_id": null,
    "verification_hardware": null,
    "verification_date": null,
    "verification_notes": null,
    "created_at": "2025-07-19T19:56:14.970473+00:00",
    "updated_at": "2025-07-19T19:56:14.970473+00:00",
    "benchmark_name": "TAU-bench Retail"
  }
]